<?xml version="1.0"?>
<xs:schema xmlns:xs="http://www.w3.org/2001/XMLSchema" elementFormDefault="qualified">

   <xs:include schemaLocation="SharedDatas.xsd"/>

   <xs:element name="TriggerablesDatas">
      <xs:complexType>
         <xs:sequence>
            <xs:element name="TriggerableDatas" minOccurs="0" maxOccurs="unbounded">
               <xs:complexType>
                  <xs:sequence>
                     <xs:element name="ValidSources" minOccurs="0" maxOccurs ="1">
                        <xs:complexType>
                           <xs:sequence>
                              <xs:element name="SourceType" type="TriggerSourceType" minOccurs="1" maxOccurs ="unbounded"/>
                           </xs:sequence>
                        </xs:complexType>
                     </xs:element>
                     <xs:element name="MaxTriggersCount" type="xs:positiveInteger" minOccurs="0" maxOccurs="1"/>
                     <xs:element name="OnTrigger" minOccurs="0" maxOccurs="1">
                        <xs:complexType>
                           <xs:sequence>
                              <xs:element name="Loot" type="LootDatas" minOccurs="0" maxOccurs="1"/>
                              <xs:element name="Trauma" type="TraumaDatas" minOccurs="0" maxOccurs="1"/>
                              <xs:element name="SpawnFromPool" type="xs:token" minOccurs="0" maxOccurs="unbounded"/>
                              <xs:element name="AnimatorTrigger" type="xs:token" minOccurs="0" maxOccurs="1"/>
                           </xs:sequence>
                        </xs:complexType>
                     </xs:element>
                  </xs:sequence>
                  <xs:attribute name="Id" type="xs:token" use="required"/>
               </xs:complexType>
            </xs:element>
         </xs:sequence>
      </xs:complexType>
   </xs:element>

   <xs:simpleType name="TriggerSourceType" final="restriction">
      <xs:restriction base="xs:string">
         <xs:enumeration value="ATTACK"/>
         <xs:enumeration value="ROLL"/>
         <xs:enumeration value="FALL"/>
      </xs:restriction>
   </xs:simpleType>

</xs:schema>